{
  "capability": "media.audio.convert",
  "provider": "ffmpeg",
  "model": "ffmpeg-9",
  "input": {
    "type": "audio",
    "path": "/Users/tseka_luk/workspace/lab/spacialist/docs/assets/e2e/meeting-two-speaker.wav",
    "size_bytes": 640932,
    "sha256": "7aa37c6f7c8e4635fcd6ac9ee3c2bca058af44536cb5dcd4bafb73f0d2801c45"
  },
  "result": {
    "audio_path": "artifact://d8608691ddc91998a8ffcc550097547ca10a762752c4910feca016a99526ea6d",
    "mime": "audio/flac",
    "format": "flac",
    "deterministic": true
  },
  "performance": {
    "latency_ms": 116,
    "device": "cpu",
    "memory_mb": 199.1,
    "cached": false,
    "cold_start": true
  },
  "warnings": [
    "confidence threshold could not be evaluated because the provider returned no confidence"
  ],
  "error": null,
  "observations": [
    {
      "id": "obs_db3b75a4f7e4db33",
      "type": "operator_result",
      "value": {
        "audio_path": "artifact://d8608691ddc91998a8ffcc550097547ca10a762752c4910feca016a99526ea6d",
        "mime": "audio/flac",
        "format": "flac",
        "deterministic": true
      },
      "evidence": [
        {
          "provider": "ffmpeg",
          "model": "ffmpeg-9"
        }
      ],
      "provenance": {
        "source": {
          "type": "audio",
          "path": "/Users/tseka_luk/workspace/lab/spacialist/docs/assets/e2e/meeting-two-speaker.wav",
          "size_bytes": 640932,
          "sha256": "7aa37c6f7c8e4635fcd6ac9ee3c2bca058af44536cb5dcd4bafb73f0d2801c45"
        },
        "provider": "ffmpeg",
        "model_version": "ffmpeg-9",
        "runtime_version": "1.0.4",
        "transformations": []
      }
    }
  ],
  "evidence": [
    {
      "provider": "ffmpeg",
      "model": "ffmpeg-9"
    }
  ],
  "artifacts": [
    {
      "id": "artifact_d8608691ddc91998a8ffcc550097547ca10a762752c4910feca016a99526ea6d",
      "mime": "audio/wav",
      "size_bytes": 128059,
      "sha256": "d8608691ddc91998a8ffcc550097547ca10a762752c4910feca016a99526ea6d",
      "uri": "artifact://d8608691ddc91998a8ffcc550097547ca10a762752c4910feca016a99526ea6d",
      "metadata": {
        "source_name": "meeting-two-speaker-93c37916250b5f8e.flac",
        "capability": "media.audio.convert",
        "result_key": "audio_path"
      }
    }
  ],
  "metrics": {
    "latency_ms": 116,
    "device": "cpu",
    "memory_mb": 199.1,
    "cached": false,
    "cold_start": true,
    "observation_count": 1,
    "artifact_count": 1,
    "deterministic": true,
    "privacy_level": "safe"
  },
  "provenance": {
    "source": {
      "type": "audio",
      "path": "/Users/tseka_luk/workspace/lab/spacialist/docs/assets/e2e/meeting-two-speaker.wav",
      "size_bytes": 640932,
      "sha256": "7aa37c6f7c8e4635fcd6ac9ee3c2bca058af44536cb5dcd4bafb73f0d2801c45"
    },
    "provider": "ffmpeg",
    "model_version": "ffmpeg-9",
    "runtime_version": "1.0.4",
    "transformations": [],
    "deterministic": true,
    "privacy_level": "safe",
    "cache": {
      "enabled": true,
      "sensitive_override": false
    },
    "children": []
  },
  "confidence": null,
  "trace": [
    {
      "stage": "routing",
      "requested": {
        "capability": "media.audio.convert",
        "options": {
          "format": "flac",
          "allow_remote": false
        }
      },
      "profile": "balanced",
      "constraints": {
        "max_latency_ms": null,
        "max_memory_mb": null,
        "min_confidence": 0.7,
        "allow_remote": false,
        "local_only": true,
        "fallback": true,
        "profile": "balanced"
      },
      "candidates": [
        {
          "capability": "media.audio.convert",
          "provider": "ffmpeg",
          "model": "ffmpeg-9",
          "quality": 0.82,
          "estimated_latency_ms": 20,
          "memory_mb": 128,
          "local": true,
          "commercial": true,
          "available": true,
          "allowed": true,
          "score": 0.794625,
          "reasons": []
        }
      ],
      "rejected": [],
      "selected": {
        "capability": "media.audio.convert",
        "provider": "ffmpeg",
        "model": "ffmpeg-9",
        "quality": 0.82,
        "estimated_latency_ms": 20,
        "memory_mb": 128,
        "local": true,
        "commercial": true,
        "available": true,
        "allowed": true,
        "score": 0.794625,
        "reasons": []
      },
      "reason": "highest deterministic utility score; ties are resolved by provider and model name"
    },
    {
      "stage": "policy",
      "profile": "balanced",
      "constraints": {
        "max_latency_ms": null,
        "max_memory_mb": null,
        "min_confidence": 0.7,
        "allow_remote": false,
        "local_only": true,
        "fallback": true,
        "profile": "balanced"
      },
      "decision": {
        "allowed": true,
        "reasons": []
      }
    },
    {
      "stage": "verification",
      "mode": "none",
      "status": "unavailable",
      "threshold": 0.7
    }
  ]
}
