{
  "capability": "vision.transform.crop",
  "provider": "opencv",
  "model": "opencv-5",
  "input": {
    "type": "image",
    "path": "/Users/tseka_luk/workspace/lab/spacialist/docs/assets/e2e/bus-input.jpg",
    "size_bytes": 137419,
    "sha256": "c02019c4979c191eb739ddd944445ef408dad5679acab6fd520ef9d434bfbc63"
  },
  "result": {
    "image_path": "artifact://90b98a0b8bab27944f4f3e3fee9422bddc05e9c10d7cd95b4d67fade4ef8ce94",
    "operation": "crop",
    "deterministic": true
  },
  "performance": {
    "latency_ms": 0,
    "device": "cpu",
    "memory_mb": 190.2,
    "cached": true,
    "cold_start": true
  },
  "warnings": [
    "confidence threshold could not be evaluated because the provider returned no confidence"
  ],
  "error": null,
  "observations": [
    {
      "id": "obs_4dc896e29ffbb19f",
      "type": "operator_result",
      "value": {
        "image_path": "artifact://90b98a0b8bab27944f4f3e3fee9422bddc05e9c10d7cd95b4d67fade4ef8ce94",
        "operation": "crop",
        "deterministic": true
      },
      "evidence": [
        {
          "provider": "opencv",
          "model": "opencv-5"
        }
      ],
      "provenance": {
        "source": {
          "type": "image",
          "path": "/Users/tseka_luk/workspace/lab/spacialist/docs/assets/e2e/bus-input.jpg",
          "size_bytes": 137419,
          "sha256": "c02019c4979c191eb739ddd944445ef408dad5679acab6fd520ef9d434bfbc63"
        },
        "provider": "opencv",
        "model_version": "opencv-5",
        "runtime_version": "1.0.4",
        "transformations": []
      }
    }
  ],
  "evidence": [
    {
      "provider": "opencv",
      "model": "opencv-5"
    }
  ],
  "artifacts": [
    {
      "id": "artifact_90b98a0b8bab27944f4f3e3fee9422bddc05e9c10d7cd95b4d67fade4ef8ce94",
      "mime": "image/png",
      "size_bytes": 591462,
      "sha256": "90b98a0b8bab27944f4f3e3fee9422bddc05e9c10d7cd95b4d67fade4ef8ce94",
      "uri": "artifact://90b98a0b8bab27944f4f3e3fee9422bddc05e9c10d7cd95b4d67fade4ef8ce94",
      "metadata": {
        "source_name": "transform-c02019c4979c191e-crop.png",
        "capability": "vision.transform.crop",
        "result_key": "image_path"
      }
    }
  ],
  "metrics": {
    "latency_ms": 268,
    "device": "cpu",
    "memory_mb": 190.2,
    "cached": false,
    "cold_start": true,
    "observation_count": 1,
    "artifact_count": 1,
    "deterministic": true,
    "privacy_level": "safe"
  },
  "provenance": {
    "source": {
      "type": "image",
      "path": "/Users/tseka_luk/workspace/lab/spacialist/docs/assets/e2e/bus-input.jpg",
      "size_bytes": 137419,
      "sha256": "c02019c4979c191eb739ddd944445ef408dad5679acab6fd520ef9d434bfbc63"
    },
    "provider": "opencv",
    "model_version": "opencv-5",
    "runtime_version": "1.0.4",
    "transformations": [],
    "deterministic": true,
    "privacy_level": "safe",
    "cache": {
      "enabled": true,
      "sensitive_override": false
    },
    "children": []
  },
  "confidence": null,
  "trace": [
    {
      "stage": "routing",
      "requested": {
        "capability": "vision.transform.crop",
        "options": {
          "x": 3,
          "y": 229,
          "width": 792,
          "height": 499,
          "allow_remote": false
        }
      },
      "profile": "balanced",
      "constraints": {
        "max_latency_ms": null,
        "max_memory_mb": null,
        "min_confidence": 0.7,
        "allow_remote": false,
        "local_only": true,
        "fallback": true,
        "profile": "balanced"
      },
      "candidates": [
        {
          "capability": "vision.transform.crop",
          "provider": "opencv",
          "model": "opencv-5",
          "quality": 0.82,
          "estimated_latency_ms": 20,
          "memory_mb": 128,
          "local": true,
          "commercial": true,
          "available": true,
          "allowed": true,
          "score": 0.794625,
          "reasons": []
        }
      ],
      "rejected": [],
      "selected": {
        "capability": "vision.transform.crop",
        "provider": "opencv",
        "model": "opencv-5",
        "quality": 0.82,
        "estimated_latency_ms": 20,
        "memory_mb": 128,
        "local": true,
        "commercial": true,
        "available": true,
        "allowed": true,
        "score": 0.794625,
        "reasons": []
      },
      "reason": "highest deterministic utility score; ties are resolved by provider and model name"
    },
    {
      "stage": "policy",
      "profile": "balanced",
      "constraints": {
        "max_latency_ms": null,
        "max_memory_mb": null,
        "min_confidence": 0.7,
        "allow_remote": false,
        "local_only": true,
        "fallback": true,
        "profile": "balanced"
      },
      "decision": {
        "allowed": true,
        "reasons": []
      }
    },
    {
      "stage": "verification",
      "mode": "none",
      "status": "unavailable",
      "threshold": 0.7
    }
  ]
}
