{
  "capability": "vision.embed_text",
  "provider": "openclip",
  "model": "siglip2-balanced",
  "input": {
    "type": "text",
    "path": "docs/assets/e2e/bus-input.jpg",
    "size_bytes": 137419,
    "sha256": "c02019c4979c191eb739ddd944445ef408dad5679acab6fd520ef9d434bfbc63"
  },
  "result": {
    "embedding": {
      "dimension": 768,
      "normalized": true,
      "model": "siglip2-balanced",
      "artifact": "artifact://7626249b0fe4a328f80cad8e5f0fbc280de62c18a7ce5bb8bbfe2e2d5e5a9634"
    },
    "embedding_path": "artifact://7626249b0fe4a328f80cad8e5f0fbc280de62c18a7ce5bb8bbfe2e2d5e5a9634",
    "dimension": 768,
    "normalized": true
  },
  "performance": {
    "latency_ms": 0,
    "device": "cpu",
    "memory_mb": 190.2,
    "cached": true,
    "cold_start": true
  },
  "warnings": [
    "confidence threshold could not be evaluated because the provider returned no confidence"
  ],
  "error": null,
  "observations": [
    {
      "id": "obs_d9439666e59212bd",
      "type": "embedding",
      "value": {
        "artifact": "artifact://7626249b0fe4a328f80cad8e5f0fbc280de62c18a7ce5bb8bbfe2e2d5e5a9634",
        "dimension": 768,
        "model": "siglip2-balanced"
      },
      "evidence": [
        {
          "provider": "openclip",
          "model": "siglip2-balanced"
        }
      ],
      "provenance": {
        "source": {
          "type": "text",
          "path": "docs/assets/e2e/bus-input.jpg",
          "size_bytes": 137419,
          "sha256": "c02019c4979c191eb739ddd944445ef408dad5679acab6fd520ef9d434bfbc63"
        },
        "provider": "openclip",
        "model_version": "siglip2-balanced",
        "runtime_version": "1.0.4",
        "transformations": []
      }
    }
  ],
  "evidence": [
    {
      "provider": "openclip",
      "model": "siglip2-balanced"
    }
  ],
  "artifacts": [
    {
      "id": "artifact_7626249b0fe4a328f80cad8e5f0fbc280de62c18a7ce5bb8bbfe2e2d5e5a9634",
      "mime": "application/json",
      "size_bytes": 16383,
      "sha256": "7626249b0fe4a328f80cad8e5f0fbc280de62c18a7ce5bb8bbfe2e2d5e5a9634",
      "uri": "artifact://7626249b0fe4a328f80cad8e5f0fbc280de62c18a7ce5bb8bbfe2e2d5e5a9634",
      "metadata": {
        "source_name": "embedding-84ab91816600c8966a5c7975.json",
        "capability": "vision.embed_text",
        "result_key": "embedding_path"
      }
    }
  ],
  "metrics": {
    "latency_ms": 311469,
    "device": "cpu",
    "memory_mb": 190.2,
    "cached": false,
    "cold_start": true,
    "observation_count": 1,
    "artifact_count": 1,
    "deterministic": false,
    "privacy_level": "safe"
  },
  "provenance": {
    "source": {
      "type": "text",
      "path": "docs/assets/e2e/bus-input.jpg",
      "size_bytes": 137419,
      "sha256": "c02019c4979c191eb739ddd944445ef408dad5679acab6fd520ef9d434bfbc63"
    },
    "provider": "openclip",
    "model_version": "siglip2-balanced",
    "runtime_version": "1.0.4",
    "transformations": [],
    "deterministic": false,
    "privacy_level": "safe",
    "cache": {
      "enabled": true,
      "sensitive_override": false
    },
    "children": []
  },
  "confidence": null,
  "trace": [
    {
      "stage": "routing",
      "requested": {
        "capability": "vision.embed_text",
        "options": {
          "text": "a city bus in a street",
          "allow_remote": false
        }
      },
      "profile": "balanced",
      "constraints": {
        "max_latency_ms": null,
        "max_memory_mb": null,
        "min_confidence": 0.7,
        "allow_remote": false,
        "local_only": true,
        "fallback": true,
        "profile": "balanced"
      },
      "candidates": [
        {
          "capability": "vision.embed_text",
          "provider": "openclip",
          "model": "siglip2-balanced",
          "quality": 0.82,
          "estimated_latency_ms": 327,
          "memory_mb": 1024,
          "local": true,
          "commercial": true,
          "available": true,
          "allowed": true,
          "score": 0.4834,
          "reasons": []
        }
      ],
      "rejected": [],
      "selected": {
        "capability": "vision.embed_text",
        "provider": "openclip",
        "model": "siglip2-balanced",
        "quality": 0.82,
        "estimated_latency_ms": 327,
        "memory_mb": 1024,
        "local": true,
        "commercial": true,
        "available": true,
        "allowed": true,
        "score": 0.4834,
        "reasons": []
      },
      "reason": "highest deterministic utility score; ties are resolved by provider and model name"
    },
    {
      "stage": "policy",
      "profile": "balanced",
      "constraints": {
        "max_latency_ms": null,
        "max_memory_mb": null,
        "min_confidence": 0.7,
        "allow_remote": false,
        "local_only": true,
        "fallback": true,
        "profile": "balanced"
      },
      "decision": {
        "allowed": true,
        "reasons": []
      }
    },
    {
      "stage": "verification",
      "mode": "none",
      "status": "unavailable",
      "threshold": 0.7
    }
  ]
}
