{
  "capability": "identity.face.detect",
  "provider": "insightface",
  "model": "buffalo_l",
  "input": {
    "type": "image",
    "path": "/Users/tseka_luk/workspace/lab/spacialist/docs/assets/e2e/person-input.jpg",
    "size_bytes": 28379,
    "sha256": "e24a2435684fee028b4ff7a7c94c8b3e0052f5e19e0bcba4f03bee8d6407a113"
  },
  "result": {
    "faces": [
      {
        "id": "face_0",
        "bbox": [
          261.351,
          100.086,
          318.581,
          169.962
        ],
        "confidence": 0.8649929761886597
      }
    ]
  },
  "performance": {
    "latency_ms": 4766,
    "device": "cpu",
    "memory_mb": 197.8,
    "cached": false,
    "cold_start": true
  },
  "warnings": [],
  "error": null,
  "observations": [
    {
      "id": "obs_23f8a6572ffff33e",
      "type": "face",
      "value": {
        "id": "face_0",
        "bbox": [
          261.351,
          100.086,
          318.581,
          169.962
        ],
        "confidence": 0.8649929761886597
      },
      "geometry": {
        "bbox": [
          261.351,
          100.086,
          318.581,
          169.962
        ]
      },
      "confidence": 0.8649929761886597,
      "evidence": [
        {
          "provider": "insightface",
          "model": "buffalo_l",
          "confidence": 0.8649929761886597
        }
      ],
      "provenance": {
        "source": {
          "type": "image",
          "path": "/Users/tseka_luk/workspace/lab/spacialist/docs/assets/e2e/person-input.jpg",
          "size_bytes": 28379,
          "sha256": "e24a2435684fee028b4ff7a7c94c8b3e0052f5e19e0bcba4f03bee8d6407a113"
        },
        "provider": "insightface",
        "model_version": "buffalo_l",
        "runtime_version": "1.0.4",
        "transformations": []
      }
    }
  ],
  "evidence": [
    {
      "provider": "insightface",
      "model": "buffalo_l",
      "confidence": 0.8649929761886597
    }
  ],
  "artifacts": [],
  "metrics": {
    "latency_ms": 4766,
    "device": "cpu",
    "memory_mb": 197.8,
    "cached": false,
    "cold_start": true,
    "observation_count": 1,
    "artifact_count": 0,
    "deterministic": false,
    "privacy_level": "restricted"
  },
  "provenance": {
    "source": {
      "type": "image",
      "path": "/Users/tseka_luk/workspace/lab/spacialist/docs/assets/e2e/person-input.jpg",
      "size_bytes": 28379,
      "sha256": "e24a2435684fee028b4ff7a7c94c8b3e0052f5e19e0bcba4f03bee8d6407a113"
    },
    "provider": "insightface",
    "model_version": "buffalo_l",
    "runtime_version": "1.0.4",
    "transformations": [],
    "deterministic": false,
    "privacy_level": "restricted",
    "cache": {
      "enabled": false,
      "sensitive_override": false
    },
    "children": []
  },
  "confidence": 0.864993,
  "trace": [
    {
      "stage": "routing",
      "requested": {
        "capability": "identity.face.detect",
        "options": {
          "allow_remote": false
        }
      },
      "profile": "balanced",
      "constraints": {
        "max_latency_ms": null,
        "max_memory_mb": null,
        "min_confidence": 0.7,
        "allow_remote": false,
        "local_only": true,
        "fallback": true,
        "profile": "balanced"
      },
      "candidates": [
        {
          "capability": "identity.face.detect",
          "provider": "insightface",
          "model": "buffalo_l",
          "quality": 0.82,
          "estimated_latency_ms": 163,
          "memory_mb": 1024,
          "local": true,
          "commercial": false,
          "available": true,
          "allowed": true,
          "score": 0.6146,
          "reasons": []
        }
      ],
      "rejected": [],
      "selected": {
        "capability": "identity.face.detect",
        "provider": "insightface",
        "model": "buffalo_l",
        "quality": 0.82,
        "estimated_latency_ms": 163,
        "memory_mb": 1024,
        "local": true,
        "commercial": false,
        "available": true,
        "allowed": true,
        "score": 0.6146,
        "reasons": []
      },
      "reason": "highest deterministic utility score; ties are resolved by provider and model name"
    },
    {
      "stage": "policy",
      "profile": "balanced",
      "constraints": {
        "max_latency_ms": null,
        "max_memory_mb": null,
        "min_confidence": 0.7,
        "allow_remote": false,
        "local_only": true,
        "fallback": true,
        "profile": "balanced"
      },
      "decision": {
        "allowed": true,
        "reasons": []
      }
    }
  ]
}
