{
  "capability": "vision.transform.colorspace",
  "provider": "opencv",
  "model": "opencv-5",
  "input": {
    "type": "image",
    "path": "/Users/tseka_luk/workspace/lab/spacialist/docs/assets/e2e/boats-input.jpg",
    "size_bytes": 194872,
    "sha256": "8c5ada657cf8110a9f8aaac954c1dd96cde0187315b581276c32b0d1863e756f"
  },
  "result": {
    "image_path": "artifact://8c722229b7f3c4f622ea50a4a3a09bd218102b7841fb9d235fb632b10de758d4",
    "operation": "colorspace",
    "deterministic": true
  },
  "performance": {
    "latency_ms": 0,
    "device": "cpu",
    "memory_mb": 191.2,
    "cached": true,
    "cold_start": true
  },
  "warnings": [
    "confidence threshold could not be evaluated because the provider returned no confidence"
  ],
  "error": null,
  "observations": [
    {
      "id": "obs_a132f489f4584a06",
      "type": "operator_result",
      "value": {
        "image_path": "artifact://8c722229b7f3c4f622ea50a4a3a09bd218102b7841fb9d235fb632b10de758d4",
        "operation": "colorspace",
        "deterministic": true
      },
      "evidence": [
        {
          "provider": "opencv",
          "model": "opencv-5"
        }
      ],
      "provenance": {
        "source": {
          "type": "image",
          "path": "/Users/tseka_luk/workspace/lab/spacialist/docs/assets/e2e/boats-input.jpg",
          "size_bytes": 194872,
          "sha256": "8c5ada657cf8110a9f8aaac954c1dd96cde0187315b581276c32b0d1863e756f"
        },
        "provider": "opencv",
        "model_version": "opencv-5",
        "runtime_version": "1.0.4",
        "transformations": []
      }
    }
  ],
  "evidence": [
    {
      "provider": "opencv",
      "model": "opencv-5"
    }
  ],
  "artifacts": [
    {
      "id": "artifact_8c722229b7f3c4f622ea50a4a3a09bd218102b7841fb9d235fb632b10de758d4",
      "mime": "image/png",
      "size_bytes": 865284,
      "sha256": "8c722229b7f3c4f622ea50a4a3a09bd218102b7841fb9d235fb632b10de758d4",
      "uri": "artifact://8c722229b7f3c4f622ea50a4a3a09bd218102b7841fb9d235fb632b10de758d4",
      "metadata": {
        "source_name": "transform-8c5ada657cf8110a-colorspace.png",
        "capability": "vision.transform.colorspace",
        "result_key": "image_path"
      }
    }
  ],
  "metrics": {
    "latency_ms": 588,
    "device": "cpu",
    "memory_mb": 191.2,
    "cached": false,
    "cold_start": true,
    "observation_count": 1,
    "artifact_count": 1,
    "deterministic": true,
    "privacy_level": "safe"
  },
  "provenance": {
    "source": {
      "type": "image",
      "path": "/Users/tseka_luk/workspace/lab/spacialist/docs/assets/e2e/boats-input.jpg",
      "size_bytes": 194872,
      "sha256": "8c5ada657cf8110a9f8aaac954c1dd96cde0187315b581276c32b0d1863e756f"
    },
    "provider": "opencv",
    "model_version": "opencv-5",
    "runtime_version": "1.0.4",
    "transformations": [],
    "deterministic": true,
    "privacy_level": "safe",
    "cache": {
      "enabled": true,
      "sensitive_override": false
    },
    "children": []
  },
  "confidence": null,
  "trace": [
    {
      "stage": "routing",
      "requested": {
        "capability": "vision.transform.colorspace",
        "options": {
          "colorspace": "Gray",
          "allow_remote": false
        }
      },
      "profile": "balanced",
      "constraints": {
        "max_latency_ms": null,
        "max_memory_mb": null,
        "min_confidence": 0.7,
        "allow_remote": false,
        "local_only": true,
        "fallback": true,
        "profile": "balanced"
      },
      "candidates": [
        {
          "capability": "vision.transform.colorspace",
          "provider": "opencv",
          "model": "opencv-5",
          "quality": 0.82,
          "estimated_latency_ms": 20,
          "memory_mb": 128,
          "local": true,
          "commercial": true,
          "available": true,
          "allowed": true,
          "score": 0.794625,
          "reasons": []
        }
      ],
      "rejected": [],
      "selected": {
        "capability": "vision.transform.colorspace",
        "provider": "opencv",
        "model": "opencv-5",
        "quality": 0.82,
        "estimated_latency_ms": 20,
        "memory_mb": 128,
        "local": true,
        "commercial": true,
        "available": true,
        "allowed": true,
        "score": 0.794625,
        "reasons": []
      },
      "reason": "highest deterministic utility score; ties are resolved by provider and model name"
    },
    {
      "stage": "policy",
      "profile": "balanced",
      "constraints": {
        "max_latency_ms": null,
        "max_memory_mb": null,
        "min_confidence": 0.7,
        "allow_remote": false,
        "local_only": true,
        "fallback": true,
        "profile": "balanced"
      },
      "decision": {
        "allowed": true,
        "reasons": []
      }
    },
    {
      "stage": "verification",
      "mode": "none",
      "status": "unavailable",
      "threshold": 0.7
    }
  ]
}
